comment_ID,comment_post_ID,comment_author,comment_author_url,comment_author_IP,comment_date,comment_date_gmt,comment_content,comment_karma,comment_approved,comment_agent,comment_type,comment_parent,user_id
43,1,Ali,https://jobskey.com/what-are-employee-retention-strategies/,81.2.249.163,2021-04-27 20:59:59,2021-04-27 20:59:59,"Huth Gergely 
Have you ever considered about including a little bit more 
than just your articles? I mean, what you say is valuable 
and all. Nevertheless think of if you added some great images or video clips to give 
your posts more, ""pop""! Your content is excellent but with 
images and video clips, this blog could certainly 
be one of the most beneficial in its field. Awesome blog!


my website :: <a href=""https://pestisracok.hu/"" rel=""nofollow ugc"">nagy segg</a>",0,0,,comment,0,0
44,1,Hester,https://jobskey.com/what-are-employee-retention-strategies/,23.90.43.39,2021-04-29 08:44:00,2021-04-29 08:44:00,"Incredible quest there. What occurred after? Take care!

Feel free to surf to my web page :: <a href=""http://penchev.bgschool.bg/profile.php?u=ibucym"" rel=""nofollow ugc"">暗号カジノ</a>",0,0,"Mozilla/5.0 (Windows NT 10.0; WOW64) AppleWebKit/537.36 (KHTML, like Gecko) Chrome/65.0.3325.181 Safari/537.36 OPR/52.0.2871.40",comment,0,0
45,1,Dotty,https://jobskey.com/what-are-employee-retention-strategies/,196.245.186.13,2021-04-29 17:30:21,2021-04-29 17:30:21,"Can I just say what a relief to find somebody who 
actually understands what they're discussing on the web.
You certainly know how to bring a problem to light and 
make it important. More people have to check this out and understand this side of the story.
I was surprised that you're not more popular because you certainly possess the gift.


Here is my web-site; <a href=""http://Dg.Szaqfdc.com/member/index.php?uid=olaxynow"" rel=""nofollow ugc"">オンライン カジノ 仮想 通貨</a>",0,0,"Mozilla/5.0 (Windows NT 10.0; WOW64) AppleWebKit/537.36 (KHTML, like Gecko) Chrome/63.0.3239.132 YaBrowser/18.2.1.196 Yowser/2.5 Safari/537.36",comment,0,0
46,1,Quinton,https://jobskey.com/what-are-employee-retention-strategies/,165.231.103.78,2021-05-01 23:31:58,2021-05-01 23:31:58,"Hello There. I found your weblog the use of msn. 
That is a really smartly written article. I'll be sure to bookmark it and come back to learn extra 
of your helpful information. Thank you for the post.
I'll certainly comeback.

Also visit my web-site: <a href=""https://stylist-profi.ru/forum/user/152603/"" rel=""nofollow ugc"">비트 코인 라이브 카지노</a>",0,0,"Mozilla/5.0 (Windows NT 10.0; WOW64) AppleWebKit/537.36 (KHTML, like Gecko) Chrome/62.0.3202.9 Safari/537.36",comment,0,0
47,1,Bethany,https://jobskey.com/what-are-employee-retention-strategies/,165.231.103.128,2021-05-02 04:20:59,2021-05-02 04:20:59,"Genuinely when someone doesn't be aware of then its up to other viewers that they 
will help, so here it occurs.

my homepage ... <a href=""http://Sirius-online.ru/user/ywihequ/"" rel=""nofollow ugc"">비트코인카지노</a>",0,0,Mozilla/5.0 (Windows NT 10.0; WOW64; rv:60.0) Gecko/20100101 Firefox/60.0,comment,0,0
48,1,Adriana,https://jobskey.com/what-are-employee-retention-strategies/,45.72.61.182,2021-05-31 18:41:52,2021-05-31 18:41:52,"The subject of gambling has indeed become one of the most longing topics 
of conversation in Indonesia. Not without help real problems, in Indonesia gambling is underestimated from various aspects ranging from culture,
religion, social, even people who put it on gambling always have a negative connotation regardless of whether the person is well-off or not in this 
industry.

In contrast to developed countries that are more entre 
to the develop of the gambling industry. There, professional gambling players are considered celebrities, are renowned and are covered in television shows.
Hailed and inspired to many who maxim it, what a 
sight that is completely lame in comparison.

It is undeniable, next viewed from an take aim reduction of view, gambling games both offline and 
judi online (<a href=""https://astrothecary.tumblr.com/"" rel=""nofollow ugc"">astrothecary.tumblr.com</a>) have evolved into a business ruckus that serve many parties.

Not on your own the organizers but next those who pretense it and some of the parties on the subject of 
it such as people who put-on in the arena of assistance technology 
and management who get the tax.

Like any supplementary issue in the world, gambling comes similar to its own risks and rewards.
No one can truly break out losses or continue to make profits in his business, 
there are always unavoidable losses and profits will continue to be pursued.
What we can pull off for thing is to locate the best strategy to minimize losses and addition profits at 
any time.",0,0,"Mozilla/5.0 (Windows NT 10.0; WOW64) AppleWebKit/537.36 (KHTML, like Gecko) DownloaderChrome/62.0.3202.75 Safari/537.36",comment,0,0
49,666,Eldon,https://jobskey.com/what-are-employee-retention-strategies/,23.90.20.117,2021-06-05 11:01:16,2021-06-05 11:01:16,"This article gives clear idea in support of the new 
visitors of blogging, that genuinely how to do running a blog.



Feel free to surf to my blog ... Judi online (<a href=""https://syairullegot.weebly.com/"" rel=""nofollow ugc"">https://syairullegot.weebly.com</a>)",0,0,"Mozilla/5.0 (Windows NT 10.0; WOW64) AppleWebKit/537.36 (KHTML, like Gecko) Chrome/65.0.3325.181 Safari/537.36 OPR/52.0.2871.40",comment,0,0
50,666,Melinda,https://jobskey.com/what-are-employee-retention-strategies/,217.219.168.212,2021-06-07 08:47:06,2021-06-07 08:47:06,"Have you ever ｃonsidered about adding ɑ littⅼе biit moｒe thаn just your articles?
I mean, what you say is fundamental and all. Nevеrtheless imagine if you addeԁ ѕome great 
visuals օr ideo clips tо gіve your posts mߋre, ""pop""!
Your contｅnt iis excellent Ьut ᴡith images ɑnd videos, tһis site cⲟuld defіnitely bе one of the 
moѕt beneficial іn іts niche. Ⅴery gooԁ blog!


my web-site; <a href=""https://www.quora.com/How-do-people-in-wheelchairs-drive-a-car/answer/Charles-Kaufman-8"" rel=""nofollow ugc"">wheelchair vans for sale</a>",0,0,Mozilla/5.0 (Windows NT 10.0; WOW64; rv:52.0) Gecko/20100101 Firefox/52.0; Firefox 52.7.3 - 111512-1801120036-1.44,comment,0,0
51,155,acunaawuhowa,https://jobskey.com/what-are-employee-retention-strategies/,62.210.178.249,2021-06-11 09:58:49,2021-06-11 09:58:49,"http://slkjfdf.net/ - Aflusuwik <a href=""http://slkjfdf.net/"" rel=""nofollow ugc"">Bixiro</a> oyg.agsp.jobskey.com.tvx.zw http://slkjfdf.net/",0,0,"Mozilla/5.0 (Windows NT 10.0; Win64; x64) AppleWebKit/537.36 (KHTML, like Gecko) Chrome/83.0.4098.0 Safari/537.36",comment,0,0
52,155,atesabuhiq,https://jobskey.com/what-are-employee-retention-strategies/,62.210.178.249,2021-06-11 10:23:16,2021-06-11 10:23:16,"http://slkjfdf.net/ - Oguhevaq <a href=""http://slkjfdf.net/"" rel=""nofollow ugc"">Omixili</a> prn.mnxl.jobskey.com.vav.kx http://slkjfdf.net/",0,0,"Mozilla/5.0 (Windows NT 6.3; Win64; x64) AppleWebKit/537.36 (KHTML, like Gecko) Chrome/83.0.4103.61 Safari/537.36",comment,0,0
53,666,Eunice,https://jobskey.com/what-are-employee-retention-strategies/,207.244.235.67,2021-09-26 22:46:04,2021-09-26 22:46:04,"I do not even know the way I finished up here, 
but I thought this publish was once great. I do not understand who you're but definitely 
you are going to a well-known blogger in case you are not 
already. Cheers!

Look at my site Delta 8 Thc Carts (<a href=""https://area52.com/delta-8-vapes/"" rel=""nofollow ugc"">Area52.Com</a>)",0,0,"Mozilla/5.0 (Windows NT 6.1; Win64; x64) AppleWebKit/537.36 (KHTML, like Gecko) Chrome/67.0.3396.87 Safari/537.36,gzip(gfe)",comment,0,0
54,157,Best Dating App 2021,https://jobskey.com/what-are-employee-retention-strategies/,194.85.248.174,2021-12-03 17:46:15,2021-12-03 17:46:15,❤️ Alice want to meet you! Click Here: http://bit.do/fSLEo ❤️,0,0,Opera/9.80 (Windows NT 6.1; MRA 6.2 (build 7443)) Presto/2.12.388 Version/12.16,comment,0,0
55,158,Best Dating App 2021,https://jobskey.com/what-are-employee-retention-strategies/,84.239.46.7,2021-12-03 17:46:23,2021-12-03 17:46:23,❤️ Alice want to meet you! Click Here: http://bit.do/fSLEo ❤️,0,0,Mozilla/5.0 (compatible; MSIE 10.0; Windows NT 6.1; Trident/6.0; MAAU; MAAU),comment,0,0
56,156,Best Dating App 2021,https://jobskey.com/what-are-employee-retention-strategies/,166.70.207.2,2021-12-03 17:46:40,2021-12-03 17:46:40,❤️ Alice want to meet you! Click Here: http://bit.do/fSLEo ❤️,0,0,"Mozilla/5.0 (Windows NT 6.1) AppleWebKit/537.36 (KHTML, like Gecko) Chrome/47.0.2526.111 YaBrowser/16.2.0.3539 Safari/537.36",comment,0,0
57,155,Best Dating App 2021,https://jobskey.com/what-are-employee-retention-strategies/,185.220.100.243,2021-12-03 17:46:55,2021-12-03 17:46:55,❤️ Alice want to meet you! Click Here: http://bit.do/fSLEo ❤️,0,0,"Mozilla/5.0 (Windows NT 6.1; WOW64) AppleWebKit/537.36 (KHTML, like Gecko) Chrome/31.0.1650.57 Safari/537.36 OPR/18.0.1284.49",comment,0,0
58,154,Best Dating App 2021,https://jobskey.com/what-are-employee-retention-strategies/,185.220.100.246,2021-12-03 17:47:08,2021-12-03 17:47:08,❤️ Alice want to meet you! Click Here: http://bit.do/fSLEo ❤️,0,0,"Mozilla/5.0 (Windows NT 6.1; WOW64) AppleWebKit/537.36 (KHTML, like Gecko) Chrome/31.0.1650.57 Safari/537.36 OPR/18.0.1284.49",comment,0,0
59,1,Best Dating App 2021,https://jobskey.com/what-are-employee-retention-strategies/,185.220.101.150,2021-12-03 17:47:21,2021-12-03 17:47:21,❤️ Alice want to meet you! Click Here: http://bit.do/fSLEo ❤️,0,0,"Mozilla/5.0 (Windows NT 6.1; WOW64) AppleWebKit/537.36 (KHTML, like Gecko) Chrome/31.0.1650.57 Safari/537.36 OPR/18.0.1284.49",comment,0,0
60,666,Best Dating App 2021,https://jobskey.com/what-are-employee-retention-strategies/,176.10.99.200,2021-12-03 17:47:38,2021-12-03 17:47:38,❤️ Alice want to meet you! Click Here: http://bit.do/fSLEo ❤️,0,0,"Mozilla/5.0 (Windows NT 6.1; WOW64) AppleWebKit/537.36 (KHTML, like Gecko) Chrome/31.0.1650.57 Safari/537.36 OPR/18.0.1284.49",comment,0,0
61,707,Best Dating App 2021,https://jobskey.com/what-are-employee-retention-strategies/,185.220.100.243,2021-12-03 17:47:51,2021-12-03 17:47:51,❤️ Alice want to meet you! Click Here: http://bit.do/fSLEo ❤️,0,0,Mozilla/5.0 (compatible; Konqueror/3.1-rc4; i686 Linux; 20020811),comment,0,0
62,834,Best Dating App 2021,https://jobskey.com/what-are-employee-retention-strategies/,185.220.100.243,2021-12-03 17:48:10,2021-12-03 17:48:10,❤️ Alice want to meet you! Click Here: http://bit.do/fSLEo ❤️,0,0,Mozilla/5.0 (compatible; Konqueror/3.1-rc4; i686 Linux; 20020811),comment,0,0
63,666,Shawna,https://jobskey.com/what-are-employee-retention-strategies/,84.17.52.63,2021-12-06 19:18:51,2021-12-06 19:18:51,"Thanks  for some other informative blog. The place else could 
I am getting that kkind of informagion written in such an ideal means?

I've a venture that I am simply now operating on, and I've been at the 
glance out ffor such info.
<a href=""https://github.com/topics/php"" rel=""nofollow ugc"">php patterns</a>

My blog ... <a href=""https://github.com/topics/mysql"" rel=""nofollow ugc"">MySQL database control</a>",0,0,Mozilla/5.0 (X11; Linux i686; rv:52.9) Gecko/20100101 Goanna/3.4 Firefox/52.9 PaleMoon/27.9.0,comment,0,0
64,1,Antonioses,https://jobskey.com/what-are-employee-retention-strategies/,95.216.37.99,2021-12-19 11:53:38,2021-12-19 11:53:38,"You are absolutely right. In it something is also idea excellent, agree with you.
Completely I share your opinion. It seems to me it is excellent idea. I agree with you.
Excuse, that I interrupt you.
It is very a pity to me, that I can help nothing to you. I hope, to you here will help.
The exact answer
 
https://behoof.in/assets/pic/",0,0,"Mozilla/5.0 (Windows NT 6.3; Win64; x64) AppleWebKit/537.36 (KHTML, like Gecko) Chrome/90.0.4430.72 Safari/537.36",comment,0,0
