comment_ID,comment_post_ID,comment_author,comment_author_url,comment_author_IP,comment_date,comment_date_gmt,comment_content,comment_karma,comment_approved,comment_agent,comment_type,comment_parent,user_id
1,1,A WordPress Commenter,https://wordpress.org/,,2020-06-15 08:00:05,2020-06-15 08:00:05,"Hi, this is a comment.
To get started with moderating, editing, and deleting comments, please visit the Comments screen in the dashboard.
Commenter avatars come from <a href=""https://gravatar.com"">Gravatar</a>.",0,0,,comment,0,0
2,158,Major,https://jobskey.com/what-are-employee-retention-strategies/,198.12.81.250,2020-06-23 08:09:02,2020-06-23 08:09:02,"My relatives every time say that I am wasting my time here at net, except I know I am getting experience everyday by reading such nice posts.



my website; why is my hair so oily very soon after washing (<a href=""https://wiki.modda.se/Anv%C3%A4ndare:Rosa43P9204"" rel=""nofollow ugc"">https://wiki.modda.se/</a>)",0,0,"Mozilla/5.0 (Windows NT 6.3; Win64; x64) AppleWebKit/537.36 (KHTML, like Gecko) Chrome/66.0.3359.139 Safari/537.36",comment,0,0
3,158,Maria,https://jobskey.com/what-are-employee-retention-strategies/,23.229.14.227,2020-06-29 22:17:21,2020-06-29 22:17:21,Melasma tem tratamento mas não tem cura. https://Hourlitter11.Doodlekit.com/blog/entry/9819525/o-que-233-melasma-sintomas-causas-e-tratamentos,0,0,"Mozilla/5.0 (X11; Linux x86_64) AppleWebKit/537.36 (KHTML, like Gecko) Chrome/51.0.2705.45 Safari/537.36",comment,0,0
4,158,Parbrize JAGUAR XF X250 2013,https://jobskey.com/what-are-employee-retention-strategies/,82.76.81.221,2020-06-30 18:17:59,2020-06-30 18:17:59,"Good day! I could have sworn I've been to this blog 
before but after browsing through some of the post I 
realized it's new to me. Anyhow, I'm definitely delighted I 
found it and I'll be bookmarking and checking back frequently! https://vanzari-parbrize.ro/parbrize/parbrize-jaguar.html",0,0,"Mozilla/5.0 (Windows; U; Windows NT 5.2; en-US) AppleWebKit/537.36 (KHTML, like Gecko) Chrome/40.0.2214.89 Safari/537.36 UCBrowser/11.3.5.908",comment,0,0
5,157,7 toips for remote team motivation - Jobskey Staffing and Recruiting Firm,https://jobskey.com/7-tips-to-keep-your-remote-team-motivated/,185.214.124.58,2020-07-09 09:56:30,2020-07-09 09:56:30,"[&#8230;] motivate your team members during the lockdown period, Here are 7 tips that will help you properly manage work in [&#8230;]",0,0,The Incutio XML-RPC PHP Library -- WordPress/5.4.2,pingback,0,0
6,1,7 toips for remote team motivation - Jobskey Staffing and Recruiting Firm,https://jobskey.com/7-tips-to-keep-your-remote-team-motivated/,185.214.124.58,2020-07-09 09:56:59,2020-07-09 09:56:59,"[&#8230;] is an important part of any business to excel in the long run. If you want a team that is both focussed and dedicated during lockdown, it is certain that you should keep an open [&#8230;]",0,0,The Incutio XML-RPC PHP Library -- WordPress/5.4.2,pingback,0,0
7,155,7 tips for remote team motivation - Jobskey Staffing and Recruiting Firm,https://jobskey.com/7-tips-to-keep-your-remote-team-motivated/,185.214.124.58,2020-07-09 10:03:43,2020-07-09 10:03:43,"[&#8230;] staff. It can be beneficial for interacting with the employees, brainstorming, planning ahead of time and conducting team building activities in [&#8230;]",0,0,The Incutio XML-RPC PHP Library -- WordPress/5.4.2,pingback,0,0
8,158,Arnette,https://jobskey.com/what-are-employee-retention-strategies/,23.94.158.190,2020-07-12 20:44:51,2020-07-12 20:44:51,"It's an awesome paragraph for all the internet visitors; they will get benefit from it I am 
sure.

Also visit my web-site; books (<a href=""http://pcgwow.svenlowry.co.uk/member.php?action=profile&amp;uid=289474"" rel=""nofollow ugc"">http://pcgwow.svenlowry.co.uk/</a>)",0,0,"Mozilla/5.0 (Windows NT 6.3; WOW64) AppleWebKit/537.36 (KHTML, like Gecko) Chrome/67.0.3381.1 Safari/537.36",comment,0,0
9,666,8 Tips to Improve Employee Experience in 2020 - Jobskey,https://jobskey.com/8-tips-to-improve-employee-experience-in-2020/,185.214.124.58,2020-07-15 05:18:49,2020-07-15 05:18:49,"[&#8230;] As an employer of present days, you have to make sure that your employees are rightly trained and motivated, for which their employee experience needs to be enhanced . The main goal of an employer must be, [&#8230;]",0,0,The Incutio XML-RPC PHP Library -- WordPress/5.4.2,pingback,0,0
10,1,Desiree,https://jobskey.com/what-are-employee-retention-strategies/,188.93.133.214,2020-07-31 20:51:48,2020-07-31 20:51:48,"hello!,I really like your writing very much! share we be 
in contact more about your article on AOL? I need an expert 
in this space to unravel my problem. May be that is you!
Taking a look ahead to peer you.

my homepage ... <a href=""https://flotgaming.net/forums/member.php?u=5014-NonaMcdougall1"" rel=""nofollow ugc"">Movie Trailers Area</a>",0,0,Mozilla/5.0 (Windows NT 6.3; WOW64; rv:59.0) Gecko/20100101 Firefox/59.0,comment,0,0
11,1,Parbrize KIA CARNIVAL II GQ 2006,https://jobskey.com/what-are-employee-retention-strategies/,82.79.236.59,2020-08-01 14:04:59,2020-08-01 14:04:59,"Hi there! I know this is kind of off topic but I was 
wondering if you knew where I could find a captcha plugin for my comment form?
I'm using the same blog platform as yours and I'm having 
trouble finding one? Thanks a lot! https://vanzari-parbrize.ro/parbrize/parbrize-kia.html",0,0,Mozilla/5.0 (X11; Linux i686; rv:52.9) Gecko/20100101 Goanna/3.4 Firefox/52.9 PaleMoon/27.8.3,comment,0,0
12,1,Jennifer,https://jobskey.com/what-are-employee-retention-strategies/,191.101.67.9,2020-08-03 01:22:00,2020-08-03 01:22:00,"Thanks  for some other fantastic article. The place else could 
anybody get that kind of information in such an ideal method 
of writing? I have a presentation subsequent week, and I am on the look for such information.

Check out my web page <a href=""https://royalcbd.com/"" rel=""nofollow ugc"">Buy CBD</a>",0,0,"Mozilla/5.0 (X11; Datanyze; Linux x86_64) AppleWebKit/537.36 (KHTML, like Gecko) Chrome/65.0.3325.181 Safari/537.36",comment,0,0
13,1,Brayden,https://jobskey.com/what-are-employee-retention-strategies/,37.123.246.13,2020-08-03 08:12:28,2020-08-03 08:12:28,"Ahaa, its fastidious dialogue on the topic of this post here at this web site,
I have read all that, so now me also commenting at 
this place.

My blog :: <a href=""https://movietrailersarea.org"" rel=""nofollow ugc"">www.MovieTrailersArea.org</a>",0,0,"Mozilla/5.0 (X11; Linux x86_64) AppleWebKit/605.1.15 (KHTML, like Gecko) Version/11.0 Safari/605.1.15 Epiphany/605.1.15",comment,0,0
14,1,Parbrize auto MITSUBISHI L 300 DELICA II Platform Ch 2019,https://jobskey.com/what-are-employee-retention-strategies/,82.76.234.254,2020-08-06 23:50:30,2020-08-06 23:50:30,I constantly spent my half an hour to read this blog's articles or reviews everyday along with a cup of coffee. https://vanzari-parbrize.ro/parbrize/parbrize-mitsubishi.html,0,0,"Mozilla/5.0 (X11; Linux x86_64) AppleWebKit/537.36 (KHTML, like Gecko) Chrome/66.0.3359.106 Safari/537.36",comment,0,0
15,1,Shay,https://jobskey.com/what-are-employee-retention-strategies/,213.142.156.231,2020-08-11 04:02:33,2020-08-11 04:02:33,"seo paketleri, seo hizmeti, seo satın al
seo paketleri, seo hizmeti, seo satın al
seo paketleri, seo hizmeti, <a href=""https://www.SeoBayi.NET"" rel=""nofollow ugc"">seo satın al</a>",0,0,Mozilla/5.0 (X11; Ubuntu; Linux x86_64; rv:57.0) Gecko/20100101 Firefox/4E2F,comment,0,0
16,1,Thao,https://jobskey.com/what-are-employee-retention-strategies/,213.142.156.231,2020-08-22 11:01:32,2020-08-22 11:01:32,"seo paketleri, seo hizmeti, seo satın al
seo paketleri, seo hizmeti, <a href=""https://www.SeoBayi.NET"" rel=""nofollow ugc"">seo satın al</a>
seo paketleri, seo hizmeti, seo satın al",0,0,"Mozilla/5.0 (X11; Linux x86_64) AppleWebKit/537.36 (KHTML, like Gecko) Chrome/66.0.3359.181 Safari/537.36",comment,0,0
17,707,What are Employee Retention Strategies? - Jobskey,https://jobskey.com/what-are-employee-retention-strategies/,185.214.124.58,2020-09-02 06:29:23,2020-09-02 06:29:23,"[&#8230;] plans to do so. If your wish is to improve employee retention rate, you should create a positive work culture, take care of employee motivation and engage with your employees, so they stick with the [&#8230;]",0,0,The Incutio XML-RPC PHP Library -- WordPress/5.4.2,pingback,0,0
18,666,What are Employee Retention Strategies? - Jobskey,https://jobskey.com/what-are-employee-retention-strategies/,185.214.124.58,2020-09-02 06:29:51,2020-09-02 06:29:51,[&#8230;] are an important element that should be emphasised by organizations. It encourages talent and motivates staff to be a contributor to the company&#8217;s overall [&#8230;],0,0,The Incutio XML-RPC PHP Library -- WordPress/5.4.2,pingback,0,0
19,1,What are Employee Retention Strategies? Jobskey - Staffing Solutions,https://jobskey.com/what-are-employee-retention-strategies/,185.214.124.58,2020-09-02 06:30:17,2020-09-02 06:30:17,[&#8230;] employee would want to work at a harmonious work atmosphere where they feel secure and happy. Which brings us [&#8230;],0,0,The Incutio XML-RPC PHP Library -- WordPress/5.4.2,pingback,0,0
20,154,What are Employee Retention Strategies? Jobskey - Staffing Solutions,https://jobskey.com/what-are-employee-retention-strategies/,185.214.124.58,2020-09-02 06:30:37,2020-09-02 06:30:37,"[&#8230;] are the driving force of an organisation. So, show appreciation to your hard-working employees by recognising and celebrating their work in front of others. Give them an appreciation [&#8230;]",0,0,The Incutio XML-RPC PHP Library -- WordPress/5.4.2,pingback,0,0
21,1,справка из физкультурного диспансера купить спб,https://jobskey.com/what-are-employee-retention-strategies/,94.181.174.45,2020-09-02 11:16:21,2020-09-02 11:16:21,"hello!,I like your writing so a lot! proportion we keep 
up a correspondence more approximately your article on AOL?

I require an expert in this space to solve my problem. May be that is you!
Having a look forward to look you. https://spravki-profi.com/kupit-medicinskuyu-spravku-po-forme-302-n/",0,0,"Mozilla/5.0 (Macintosh; Intel Mac OS X 10_10_5) AppleWebKit/537.36 (KHTML, like Gecko) Chrome/67.0.3396.79 Safari/537.36",comment,0,0
22,155,Facebook Marketing,https://jobskey.com/what-are-employee-retention-strategies/,213.217.225.176,2020-09-12 10:10:03,2020-09-12 10:10:03,"I'm extremely inspired with your writing skills and also with the format in your weblog. Is that this a paid theme or did you customize it yourself? Anyway keep up the excellent high quality writing, it's uncommon to peer a nice weblog like this one nowadays.",0,0,"Mozilla/5.0 (Windows NT 10.0; Win64; x64) AppleWebKit/537.36 (KHTML, like Gecko) Chrome/62.0.3202.94 Safari/537.36",comment,0,0
23,707,Affiliate Marketing,https://jobskey.com/what-are-employee-retention-strategies/,213.217.225.176,2020-09-12 17:11:17,2020-09-12 17:11:17,"I am extremely impressed with your writing abilities and also with the layout to your weblog. Is this a paid theme or did you modify it your self? Anyway keep up the nice high quality writing, it's uncommon to see a great blog like this one these days.",0,0,"Mozilla/5.0 (Windows NT 10.0; Win64; x64) AppleWebKit/537.36 (KHTML, like Gecko) Chrome/62.0.3202.94 Safari/537.36",comment,0,0
24,1,Catherine,https://jobskey.com/what-are-employee-retention-strategies/,83.142.54.44,2020-09-13 06:20:56,2020-09-13 06:20:56,"Howdy are using Wordpress for your blog platform? I'm new to the blog world but I'm trying to 
get started and create my own. Do you need any 
coding knowledge to make your own blog? Any help would be greatly appreciated!


My web-site <a href=""https://semlink.calvinseminary.edu/go/pdf/Generico_De_La_Levitra_Levitra_Generico_Da_10_Mg_Farmac_a_bk3.pdf"" rel=""nofollow ugc"">levitra</a>",0,0,Mozilla/5.0 (X11; Linux x86_64; rv:52.9) Gecko/20100101 Goanna/3.4 Firefox/52.9 PaleMoon/27.9.0,comment,0,0
25,1,Avis,https://jobskey.com/what-are-employee-retention-strategies/,93.177.119.68,2020-09-17 08:23:51,2020-09-17 08:23:51,"Hi there colleagues, its wonderful paragraph regarding tutoringand entirely defined, keep it up all the time.


Have a look at my web-site :: <a href=""http://www.adamar.org/pdf/Fluconazol_Comprar_Espa_a_Precio_Del_Diflucan_farmac_a_S__fr4.pdf"" rel=""nofollow ugc"">diflucan</a>",0,0,"Mozilla/5.0 (X11; Linux x86_64) AppleWebKit/537.36 (KHTML, like Gecko) Chrome/66.0.3359.181 Safari/537.36",comment,0,0
26,1,Elba,https://jobskey.com/what-are-employee-retention-strategies/,46.8.23.113,2020-10-05 05:46:24,2020-10-05 05:46:24,"Надо на колени встать когда нажимаешь и свечку зажечь

Take a look at my page: <a href=""https://pesnitext.ru/dinar-rahmatullin/"" rel=""nofollow ugc"">Karina</a>",0,0,"Mozilla/5.0 (Macintosh; Intel Mac OS X 10_11_6) AppleWebKit/537.36 (KHTML, like Gecko) Chrome/66.0.3359.117 Safari/537.36",comment,0,0
27,707,TageTenda,https://jobskey.com/what-are-employee-retention-strategies/,46.17.106.61,2020-10-16 16:36:17,2020-10-16 16:36:17,"21932 young sucking liza rowe deepthroats dick  http://88.211.119.37/NavigationMenu/SwitchView?Mobile=False&amp;ReturnUrl=https%3a%2f%2fmichelejullian.info%2famateur%2f16046-ass-amateur-norbertalov-chaturbatevip.php  
12367 kayden kross model erotica  http://stervaik.ru/url?e=simple_click&amp;blog_post_id=43619719560&amp;url=https://michelejullian.info/teen/2954-alice-green-gives-head-coed-cherry.php  
22425 ava addams milf big cock  https://android.codingsky.com/jump/aHR0cHM6Ly9taWNoZWxlanVsbGlhbi5pbmZvL3NleC8xNjQ4NC1vbGl2aWEtZ3JhY2UtbGlraW5nLW9yYWwtYmJ3c2VjcmV0LWNvbS5waHA=  
11731 blacked carter cruise obsession chapter whistle cock  https://radioerft.de/erft/dir/?https://michelejullian.info/cock/9491-bigbutt-blonde-nikki-gets-fucked-and-receives-creampie.php  
1472 big ass like that has to be recorded  http://www.ideamuramura.it/trigger.php?r_link=https%3a%2f%2fmichelejullian.info%2fbrunette%2f11042-pornostar-brunette-with-big-boobs-jenny-hard-getting-naked-on-the-beach.php  
13045 very hot brunette posing outdoors in war museum russian sexy  http://www.reliablesoftware.com/DasBlog/ct.ashx?id=d755fc13-aafe-4960-a2c2-5989f648a8d3&amp;url=https%3a%2f%2fmichelejullian.info%2fteen%2f23538-sexy-fisting-with-mazzy.php  
3417 amateur vintage pussy vin  https://www.insidesystems.com/changecurrency/3?returnurl=https%3a%2f%2fmichelejullian.info%2fsex%2f5682-bangbus-carmen-rae-wild-year-old-gets-fucked.php  
12709 aubrey nude in from first time girls  https://qxa.blogsky.com/dailylink/?go=https%3a%2f%2fmichelejullian.info%2fhardcore%2f13107-valentina-nappi-teens-love-anal.php&amp;id=7  
1532 hot massage and sex with cory everson my pornstar book  https://logs177.xiti.com/go.click?xts=446456&amp;s2=11&amp;p=cutepix.info%2fsex%2friley-reyes.php&amp;click=T&amp;type=click&amp;url=https%3a%2f%2fmichelejullian.info%2fpussy%2f19873-diana-dee-spreads-her-shaved-pussy-naked-erotic-models.php  
3289 teen pink teenpinkvideos model classic rar sex  http://mseminaryexxoncom.spmd.mobi/analytics/hit.php?nocache=1464979186.9115&amp;r=cutepix.info%2fsex%2friley-reyes.php&amp;a=3&amp;i=4966029&amp;r2=https%3a%2f%2fmichelejullian.info%2flesbian%2f24668-sapphic-erotica-lesbian-ashlie-and-malia.php  
10 redhead candy red got her pussy banged from behind  http://embassy.sg/view-book?page=https%3a%2f%2fmichelejullian.info%2fcock%2f4722-beautiful-blonde-masha-plays-with-hard-nipples-after-removin.php  
12569 blonde teen tamara jelena getting ass fucked and gaped  http://www.ismerfo.it/trigger.php?r_link=https%3a%2f%2fmichelejullian.info%2fbrunette%2f2289-german-brunette-katja-kassin-rubbing-her-oiled-up-pussy-by-the-poolside.php  
19451 anny aurora gets ass massaged coed cherry  http://ngpnr.ru/bitrix/redirect.php?event1=news_out&amp;event2=%2Fupload%2Fiblock%2Fb59%2Fb5904cfb2ffc6058ae82da39162824db.pdf&amp;event3=1141.pdf&amp;goto=https%3a%2f%2fmichelejullian.info%2fass%2f3065-jillian-janson-fucking-in-the-couch-with-her-small-tits.php  
12108 anal teen angels marry wet list sex  http://taipantours.com/Home/ChangeCulture?lang=zh-CN&amp;returnUrl=https%3a%2f%2fmichelejullian.info%2flesbian%2f18478-bonny-bon-lesbian.php  
928 dani daniels and shyla jennings eat each other out coed cher  https://jarocin.praca.gov.pl/be/rynek-pracy/bazy-danych/klasyfikacja-zawodow-i-specjalnosci/wyszukiwarka-opisow-zawodow//-/klasyfikacja_zawodow/zawod/215303?_jobclassificationportlet_WAR_nnkportlet_backUrl=https%3a%2f%2fmichelejullian.info%2fhairy%2f3759-ant-to-smell-hairy-pussy.php  
14529 blacked elsa gif  http://www.iikt.ovgu.de/Lehrst%C3%BChle+und+Fachgebiete/HTI/Mitarbeiter/Jan+Moritz+Joseph/extern.html?extern_param=https%3a%2f%2fmichelejullian.info%2fcock%2f22249-cock-hungry-teen-meets-up-for-anal-on-home.php  
24852 sexy big tits milf jessica roberts naked woman fat ass shaved pussy  https://magnitiza.justclick.ru/lms/api-login/?_hash=6xFMUWgUnVeyWp54L4KI3MVkdUNL2i%2BYzkh%2BAAIPPB8%3D&amp;authBhvr=1&amp;email=magnitiza%40narod.ru&amp;expire=1584682116&amp;lms%5BrememberMe%5D=1&amp;targetPath=https%3a%2f%2fmichelejullian.info%2fpussy%2f12781-busty-blonde-nina-elle-enjoys-pussy-pounding-from-hung-black-stud.php  
15407 inthecrack amirah adara set  http://joup.co/?wptouch_switch=desktop&amp;redirect=https%3a%2f%2fmichelejullian.info%2ftits%2f9705-hugely-busty-nurse-alanah-rae-looses-round-big-tits-to-fuck-patient.php  
21331 ultimate surrender izamar gutierrez cheyenne jewel national  http://www.campusquilt.com/https://michelejullian.info/stockings/19302-lucy-lume-dark-blonde-sitting-sexy-legs-stilettos-stockings-girls.php  
23458 redhead teen slut cassandra nix fucked by huge cock on barel  https://childrenshungeralliance.cloudhostedresources.com/?task=get&amp;url=https%3a%2f%2fmichelejullian.info%2fpussy%2f23449-stephanie-moon-instasex-small-tits-cadge.php",0,0,"Mozilla/5.0 (Windows NT 10.0; Win64; x64) AppleWebKit/537.36 (KHTML, like Gecko) Chrome/64.0.3282.140 Safari/537.36 Edge/17.17134",comment,0,0
28,1,Dorthy,https://jobskey.com/what-are-employee-retention-strategies/,134.19.231.200,2020-10-21 19:18:47,2020-10-21 19:18:47,"Appreciate this post. Will try it out.

my site: <a href=""https://theimpossiblequiz.live/"" rel=""nofollow ugc"">the impossible quiz</a>",0,0,"Mozilla/5.0 (Macintosh; Intel Mac OS X 10_10_4) AppleWebKit/537.36 (KHTML, like Gecko) Chrome/66.0.3359.181 Safari/537.36",comment,0,0
29,1,Annette,https://jobskey.com/what-are-employee-retention-strategies/,45.156.12.32,2020-10-29 09:57:24,2020-10-29 09:57:24,"<a href=""https://sites.google.com/view/seffaf-clan-sembolleri/"" rel=""nofollow ugc"">clan symbol</a> clan sembol 
ko sembol clan simgeleri",0,0,"Mozilla/5.0 (Macintosh; Intel Mac OS X 10_11_6) AppleWebKit/605.1.15 (KHTML, like Gecko) Version/11.1 Safari/605.1.15",comment,0,0
30,1,Marco,https://jobskey.com/what-are-employee-retention-strategies/,178.158.22.175,2020-12-02 13:18:36,2020-12-02 13:18:36,"<a href=""http://bitly.com"" rel=""nofollow ugc"">bitly.com</a> When you create 
a shortened URL. Free URL shortener to create the perfect short 
URLs for your business.",0,0,"Mozilla/5.0 (Macintosh; Intel Mac OS X 10_13_4) AppleWebKit/537.36 (KHTML, like Gecko) Chrome/66.0.3359.181 Safari/537.36",comment,0,0
31,1,Bess,https://jobskey.com/what-are-employee-retention-strategies/,178.158.15.107,2020-12-11 18:27:05,2020-12-11 18:27:05,"<a href=""http://bitly.com"" rel=""nofollow ugc"">bitly.com</a> Free custom URL Shortener 
and branded URLs Free URL shortener to create the perfect 
short URLs for your business.",0,0,Googlebot-Image/1.0,comment,0,0
32,1,Clyde,https://jobskey.com/what-are-employee-retention-strategies/,62.16.14.114,2020-12-24 17:14:40,2020-12-24 17:14:40,"Hi, i read your blog from time to time and i own a similar one and 
i was just curious if you get a lot of spam comments?
If so how do you protect against it, any plugin or anything you can suggest?
I get so much lately it's driving me crazy so any assistance is very much appreciated.


my web-site <a href=""https://privatedelights.ch/profile/irinahot"" rel=""nofollow ugc"">web</a>",0,0,"Mozilla/5.0 (Macintosh; Intel Mac OS X 10_13_4) AppleWebKit/537.36 (KHTML, like Gecko) Chrome/68.0.3415.0 Safari/537.36",comment,0,0
33,1,Paulina,https://jobskey.com/what-are-employee-retention-strategies/,23.83.87.142,2021-02-20 00:58:56,2021-02-20 00:58:56,"I will immediateⅼү grab yоur rsss feed ɑs I can not 
inn finding yoᥙr emqil subscrption hyperlink ⲟr е-newsletter service.
Do yoս have any? Kindly permit me understand ѕo that Ӏ couⅼԀ 
subscribe. Ƭhanks.

Alsso visit my site ... <a href=""http://dollarcostaveraging.us/__media__/js/netsoltrademark.php?d=cherokeemuseum.org/"" rel=""nofollow ugc"">VIVA99</a>",0,0,"Mozilla/5.0 (Windows NT 10.0) AppleWebKit/537.36 (KHTML, like Gecko) Chrome/66.0.3359.139 Safari/537.36",comment,0,0
34,1,Samira,https://jobskey.com/what-are-employee-retention-strategies/,157.90.129.61,2021-03-01 08:51:15,2021-03-01 08:51:15,"Nice post. I was checking constantly this 
weblog and I'm inspired! Very useful info particularly 
the final phase :) I care for such information a lot.
I was looking for this particular info for a long 
time. Thank you and good luck.

my homepage - <a href=""https://vernonjohns.org/"" rel=""nofollow ugc"">9poker</a>",0,0,"Mozilla/5.0 (Windows NT 10.0; Win64; x64) AppleWebKit/537.36 (KHTML, like Gecko) Chrome/65.0.3325.183 Safari/537.36 Vivaldi/1.96.1147.42",comment,0,0
35,666,ssmmdksmpe,https://jobskey.com/what-are-employee-retention-strategies/,185.56.80.65,2021-03-14 15:41:19,2021-03-14 15:41:19,Muchas gracias. ?Como puedo iniciar sesion?,0,0,Mozilla/5.0 (compatible; MSIE 9.0; Windows NT 6.1; WOW64; Trident/5.0),comment,0,0
36,1,Sonia,https://jobskey.com/what-are-employee-retention-strategies/,138.201.142.30,2021-03-15 12:48:34,2021-03-15 12:48:34,"I was wondering if you ever considered changing the layout of your website?
Its very well written; I love what youve got to say.
But maybe you could a little more in the way of content so people could connect with 
it better. Youve got an awful lot of text for only having 
1 or two pictures. Maybe you could space it out better?


Here is my site - <a href=""https://gibsonhall.com/mobile/others/isin-4d"" rel=""nofollow ugc"">ngentot</a>",0,0,"Mozilla/5.0 (Windows NT 10.0; WOW64) AppleWebKit/537.36 (KHTML, like Gecko) Chrome/55.0.2883.87 UBrowser/6.2.4091.2 Safari/537.36",comment,0,0
37,157,jotmhbfevb,https://jobskey.com/what-are-employee-retention-strategies/,199.249.230.146,2021-03-17 09:59:25,2021-03-17 09:59:25,Muchas gracias. ?Como puedo iniciar sesion?,0,0,Mozilla/5.0 (Windows NT 6.3; WOW64; rv:30.0) Gecko/20100101 Firefox/30.0,comment,0,0
38,834,ouqhfqznst,https://jobskey.com/what-are-employee-retention-strategies/,209.127.17.234,2021-03-25 03:33:14,2021-03-25 03:33:14,Muchas gracias. ?Como puedo iniciar sesion?,0,0,"Mozilla/5.0 (Windows NT 6.1) AppleWebKit/537.36 (KHTML, like Gecko) Chrome/36.0.1985.125 Safari/537.36",comment,0,0
39,1,Laurene,https://jobskey.com/what-are-employee-retention-strategies/,165.231.103.122,2021-04-13 22:18:42,2021-04-13 22:18:42,"I was recommended this web site by my cousin. I am not 
sure whether this post is written by him as nobody else 
know such detailed about my problem. You're amazing! Thanks!


Here is my blog - <a href=""http://kksz.lm.pl/index.php?co=user&amp;id=123351"" rel=""nofollow ugc"">erotyczne portale</a>",0,0,"Mozilla/5.0 (Windows NT 10.0; WOW64) AppleWebKit/537.36 (KHTML, like Gecko) Chrome/55.0.2883.87 UBrowser/6.2.4091.2 Safari/537.36",comment,0,0
40,1,Sterling,https://jobskey.com/what-are-employee-retention-strategies/,196.245.149.84,2021-04-18 09:57:41,2021-04-18 09:57:41,"This is my first time pay a visit at here and i am actually happy to 
read everthing at one place.

My homepage: <a href=""http://pumarefrattari.com/index.php/component/k2/item/18174"" rel=""nofollow ugc"">portale erotyczne</a>",0,0,"Mozilla/5.0 (Windows NT 10.0; WOW64) AppleWebKit/537.36 (KHTML, like Gecko) Chrome/65.0.3325.181 Safari/537.36 OPR/52.0.2871.99",comment,0,0
41,1,Jackson,https://jobskey.com/what-are-employee-retention-strategies/,154.16.12.200,2021-04-18 17:33:58,2021-04-18 17:33:58,"Howdy terrific website! Does running a blog such as this require a lot of work?

I have very little understanding of coding but I had been hoping 
to start my own blog soon. Anyhow, if you have any suggestions or 
techniques for new blog owners please share.

I know this is off subject nevertheless I simply wanted to ask.
Thank you!

My page: <a href=""http://felixwkkt426.wpsuo.com/advantages-of-employing-a-web-based-dating-web-site"" rel=""nofollow ugc"">seks portal randkowy</a>",0,0,"Mozilla/5.0 (Windows NT 10.0; WOW64) AppleWebKit/537.36 (KHTML, like Gecko) Chrome/65.0.3325.181 Safari/537.36 OPR/52.0.2871.99",comment,0,0
42,1,Emmett,https://jobskey.com/what-are-employee-retention-strategies/,50.3.195.12,2021-04-20 01:17:36,2021-04-20 01:17:36,"This design is steller! You certainly know how to keep a reader amused.
Between your wit and your videos, I was almost moved to start 
my own blog (well, almost...HaHa!) Great job. I really enjoyed 
what you had to say, and more than that, how you presented it.
Too cool!

My web page <a href=""https://alexisnwdt297.sitey.me/blog/post/431316/on-the-internet-courting-companies-very-simple-approaches-to-satisfy-persons-on-the-net"" rel=""nofollow ugc"">seks portal</a>",0,0,"Mozilla/5.0 (Windows NT 10.0; WOW64) AppleWebKit/537.36 (KHTML, like Gecko) Chrome/53.0.2785.104 Safari/537.36 Core/1.53.4843.400 QQBrowser/9.7.13021.400",comment,0,0
